{"$schema":"https://json-schema.org/draft/2020-12/schema","$id":"https://sayelf.dev/schemas/project.schema.json","title":"Handdraw Story Project","type":"object","additionalProperties":false,"required":["version","story","style","characters","scenes","shots"],"properties":{"version":{"const":"0.1.0"},"story":{"$ref":"story.schema.json"},"style":{"$ref":"style.schema.json"},"characters":{"type":"array","items":{"$ref":"character.schema.json"}},"props":{"type":"array","items":{"$ref":"prop.schema.json"}},"relations":{"type":"array","items":{"$ref":"relation.schema.json"}},"scenes":{"type":"array","minItems":1,"items":{"$ref":"scene.schema.json"}},"shots":{"type":"array","minItems":1,"items":{"$ref":"shot.schema.json"}},"frames":{"type":"array","items":{"$ref":"frame.schema.json"}},"motions":{"type":"array","items":{"$ref":"motion.schema.json"}},"visual_evidence":{"type":"array","items":{"$ref":"visual_evidence.schema.json"}}}}
